<?xml version="1.0" encoding="UTF-8"?>
<!DOCTYPE portion SYSTEM "..\Data\PAWSSKWriterDescription.dtd">
<portion>
  <section1 id="sExcl">
	 <secTitle>Greetings, Interjections and Exclamations</secTitle>
	 <p>
		<content>This section considers various types of common utterances which are not complete sentences.  Greetings, interjections and exclamations are covered in turn.</content>
	 </p>
	 <section2 id="sExclGreet">
		<secTitle>Greetings</secTitle>
		<p><content>Greetings typically consist of a particular word or phrase, either standing alone or followed by a name or nominal phrase describing the person or animal being greeted.  Some are full sentences or full questions, such as </content> <langData>How do you do? </langData><langData>How are you? </langData> <content> and </content><langData>Have a good day!</langData> <content> which do not need to be treated separately. </content></p>
		<p><content>Some examples of English greetings are:
		</content><langData>Hi! </langData><content>&#x20;</content><langData>Howdy! </langData><content>&#x20;</content><langData>Goodby</langData><content>, </content><langData>Good day, sir</langData><content> and </content><langData>Good night, sweet baby</langData>
		   <content>.</content>
		</p>
		<p><content>Examples of greetings in </content><langName/> <content> include:</content></p>
		<example>
		   <interlinear exampleLoc="excl/greetExample"/>
		</example>
	 </section2>
	 <section2 id="sExclIntj">
		<secTitle>Interjections</secTitle>
		<p><content>Interjections typically consist of a particular word or phrase that is used alone, usually with an exclamation point following it.  Though many of the words in interjections are not used in any other situation, regular adjectives are also used in this way.  Some examples of interjections in English are:
		</content><langData>Ouch! </langData><content>&#x20;</content><langData>Gross! </langData><content>&#x20;</content><langData>Cool! </langData><content> and </content><langData>Jimminy Cricket!</langData>
		</p>

		<p><content>Examples of interjections in </content><langName/> <content> include:</content></p>
		<example>
		   <interlinear exampleLoc="excl/intjExample"/>
		</example>
		<p><content>Yes and No answers to questions are similar to interjections.  </content><langName/><content> uses the following words to express these answers:</content></p>
		<example>
		   <table border="1">
			  <headerRow>
				 <headerCol>
					<langName/>
				 </headerCol>
				 <headerCol>Gloss</headerCol>
			  </headerRow>
			  <row>
				 <col exampleLoc="excl/yesExample"/>
				 <col>
					<content>yes</content>
				 </col>
			  </row>
			  <row>
				 <col exampleLoc="excl/noExample"/>
				 <col>
					<content>no</content>
				 </col>
			  </row>
		   </table>
		</example>
	 </section2>
	 <section2 id="sExclExcl">
		<secTitle>Exclamations</secTitle>
		<p><content>Exclamations typically consist of a particular word, such as </content><langData>how</langData><content> in English, followed by an adjective phrase and usually punctuated with an exclamation point.  English examples include:</content>
		   <langData>How awful for you! </langData><content>&#x20;</content><langData>How nice!</langData><content> and </content><langData>How wonderful that your family could come!</langData>
		</p>

		<p show="swExclMNo"><langName/><content> does not have a special word which marks exclamations of this type, so they are no different than the interjections consisting of adjectives in the previous section.</content></p>
		<p show="swExclMYes"><langName/> <content> has one or more special words which signal an exclamation which occur </content><case element="excl" attr="exclMPos">
		   <caseText value="before">before</caseText>
		   <caseText value="after">after</caseText>
		   <caseText value="either">on either side of</caseText>
		   <caseText value="both">on both sides of</caseText>
		   <caseText value="unknown">________</caseText>
		</case><content> the adjective phrase.  </content>
		   <text show="swExclMYesEitherNo"><content>There are separate sets words which can occur on each side of the adjective phrase. </content></text>
		   <text show="swExclMYesEitherYes"><content>All of the words may occur on either side of the adjective phrase. </content></text>
		   <content>These exclamation marker words are:</content></p>
		<example show="swExclMYes"><table border="1">
		   <headerRow>
			  <headerCol>Exclamation Markers</headerCol>
			  <headerCol>Gloss</headerCol>
		   </headerRow>
		   <row>
			  <col exampleLoc="excl/exclMExample"></col>
			  <col ><gloss><content>ENTER GLOSS</content></gloss></col>
		   </row>
		</table>
		</example>

		<p><content>Examples of exclamations in </content><langName/><content> include:</content></p>
		<example>
		   <interlinear exampleLoc="excl/exclExample"/>
		</example>
		</section2>
  </section1>
	<section1 id="sTexts">
		<secTitle>Texts</secTitle>
		<p><comment>Include several texts here to demonstrate how larger constructions such as paragraphs, conversations, and narrative stories are formed.  Include examples of various literary types.</comment></p>
		<p><comment>  A suggested format for presenting the texts is to present it in the vernacular language as a whole first, so the native speakers can appreciate it.  Then present the interlinear form, as in the examples throughout the grammar.  Finally, give a free translation as a whole, so the non-native speaker can appreciate more about the culture.</comment></p>
	</section1>
<showWhen id="swExclMYes">
	<whenValue element="excl" attr="exclM" value="yes"></whenValue>
</showWhen>
<showWhen id="swExclMNo">
	<whenValue element="excl" attr="exclM" value="no"></whenValue>
</showWhen>
<showWhen id="swExclMYesEitherNo">
	<whenValue element="excl" attr="exclM" value="yes"></whenValue>
<and/>
	<whenValue element="excl" attr="exclMPos" value="either"></whenValue>
<and/>
	<whenValue element="excl" attr="exclMEither" value="no"></whenValue>
<or/>
	<whenValue element="excl" attr="exclM" value="yes"></whenValue>
<and/>
	<whenValue element="excl" attr="exclMPos" value="both"></whenValue>
<and/>
	<whenValue element="excl" attr="exclMEither" value="no"></whenValue>
</showWhen>
<showWhen id="swExclMYesEitherYes">
	<whenValue element="excl" attr="exclM" value="yes"></whenValue>
<and/>
	<whenValue element="excl" attr="exclMPos" value="either"></whenValue>
<and/>
	<whenValue element="excl" attr="exclMEither" value="yes"></whenValue>
<or/>
	<whenValue element="excl" attr="exclM" value="yes"></whenValue>
<and/>
	<whenValue element="excl" attr="exclMPos" value="both"></whenValue>
<and/>
	<whenValue element="excl" attr="exclMEither" value="yes"></whenValue>
</showWhen>
</portion>
